title,score,id,url,comms_num,created,body,classifier,comms_word_count,timestamp
Do you remember?,33184,g5cmiw,https://i.redd.it/l4iu3ot7c5u41.jpg,1092,1587492888.0,,1,7847,2020-04-21 14:14:48
"CNN removed the August 11th, 1993 Larry King Episode from Google Play, the episode featuring a call from Tara Reade's mother. CNN is actively colluding with the Biden campaign to cover up evidence of Biden's sexual assault.",15967,g85p77,https://i.imgur.com/u97t8rR.png,1003,1587893920.0,,1,4865,2020-04-26 05:38:40
Critics are on the take,15338,g8epel,https://i.redd.it/ssgpe7j146v41.png,1280,1587938091.0,,1,8645,2020-04-26 17:54:51
When your POTUS retweets this.... what a time to be alive,12226,gcu0sh,https://i.redd.it/3mq3ptruzkw41.jpg,2095,1588554127.0,,1,7164,2020-05-03 21:02:07
Stephen Ruth single handedly taking on a corrupt government,11459,gd1bht,https://i.redd.it/5ktrdi7i5nw41.jpg,387,1588580241.0,,1,3706,2020-05-04 04:17:21
I feel this life.,11399,g46rbn,https://i.redd.it/nm3uspmiort41.jpg,728,1587327518.0,,1,2470,2020-04-19 16:18:38
Holy shit,10002,gebv34,https://i.redd.it/eavu0hwn62x41.jpg,773,1588762233.0,,1,4422,2020-05-06 06:50:33
These are the 37 Senators that voted to let the FBI seize your internet history without a warrant,9851,gjp9nw,https://www.privateinternetaccess.com/blog/these-are-the-37-senators-that-voted-to-let-the-fbi-seize-your-internet-history-without-a-warrant/,842,1589501274.0,,1,3957,2020-05-14 20:07:54
"Fake News CNN caught lying again! Said Elon Musk had not sent any ventilators to California. Elon Musk responds with receipts, pictures, and thank you notes from the hospitals that received over 1000 ventilators. ""What I find most surprising is that CNN still exists"" said Musk.",9776,g33gcl,https://www.newsweek.com/elon-musk-tesla-ventilators-coronavirus-covid19-california-hospitals-list-gavin-newsom-1498491,1165,1587163894.0,,1,4420,2020-04-17 18:51:34
No we don't,9680,g620qc,https://i.ibb.co/L1jY8xK/1587499001670.jpg,1184,1587594293.0,,1,8567,2020-04-22 18:24:53
Truth,9563,gh26c6,https://i.redd.it/ig0130gu3yx41.jpg,356,1589148706.0,,1,1554,2020-05-10 18:11:46
Wait... Elon liked it...,9110,gda4bn,https://i.redd.it/kus0265fkqw41.jpg,1304,1588621577.0,,1,4560,2020-05-04 15:46:17
What's going on here?,9049,gbim74,https://i.redd.it/1i0xgzflt5w41.png,1145,1588370474.0,,1,8431,2020-05-01 18:01:14
NY mayor encourages people to take pics of neighbors breaking lockdowns and send them to police. Police are flooded with Dick-pics,8411,g5l5cs,https://nypost.com/2020/04/21/de-blasios-social-distancing-tip-line-flooded-with-obscenities/,416,1587523965.0,,1,2800,2020-04-21 22:52:45
First they dumb you down.,8413,g9dx1g,https://i.redd.it/z9ooen0wogv41.jpg,1080,1588066167.0,,1,6597,2020-04-28 05:29:27
"Today marks the 50th year since the Ohio National Guard fired on Kent State University students during an anti-war protest, claiming the lives of four students and injuring nine others, on May 4, 1970. Never forget who the military actually works for.",7874,gdie7m,https://i.redd.it/vmf0ubzuvsw41.jpg,592,1588649642.0,,1,2988,2020-05-04 23:34:02
Because they're the ones posting it,7773,ghcb80,https://i.redd.it/u2kdqij3x0y41.png,793,1589182791.0,,1,4093,2020-05-11 03:39:51
Something to think about,7761,gfdl7y,https://i.redd.it/dvh726kubex41.jpg,706,1588909272.0,,1,5637,2020-05-07 23:41:12
"Oligarchs are controlling all aspects of life, they are not voted into any office, they buy all politicians, and we are forced to accept their will, regardless if its good for us, which is never the case btw",7751,gakarc,https://i.redd.it/gbkw84tocuv41.jpg,792,1588231556.0,,1,7890,2020-04-30 03:25:56
For those trying to make sense of what's going on these days.,7534,g9qd0x,https://i.redd.it/isbr9vyt4lv41.jpg,447,1588120011.0,,1,2523,2020-04-28 20:26:51
Oomph... that strikes deep,7245,ggbmda,https://i.redd.it/4304dhon7px41.png,259,1589041054.0,,1,1076,2020-05-09 12:17:34
Papaya tests positive for covid-19!,7151,ge5ewh,https://i.redd.it/ialavt80a0x41.jpg,933,1588739164.0,,1,4973,2020-05-06 00:26:04
"Due to COVID, I’ve learned about the CIA, JFK, 9/11, the Rothschilds, Gates, and much more in the space of one month. “Waking up” is almost unbearable.",6905,g6aypq,https://www.reddit.com/r/conspiracy/comments/g6aypq/due_to_covid_ive_learned_about_the_cia_jfk_911/,1455,1587623512.0,"The combination of March + April has been comparable to a bad acid trip that never ends. After 24 years, my perception of reality has been shattered. Work feels pointless. Life feels pointless. I feel dehumanized. The people around me suddenly seem so dull and brainwashed. Television has lost its appeal. I fluctuate between hating myself for being so oblivious for 24 years, and then wishing I’d never learned any of this in the first place. I feel alone, and almost psychotic. To realize how much of the world around me has been built on lies has me questioning my own sanity on a daily basis. 


There’s a reason most people choose to stay brainwashed. Reality is awful when you realize who actually runs the world, and how limited your “freedom” actually is. There are some doors that can’t be closed.


EDIT: Damn, I’m really grateful for the overwhelming messages and comments. It’s good to know I’m not the only one dealing with this right now.",1,42247,2020-04-23 02:31:52
The guy who made the post about how 92 of the top 500 subs are controlled by the same people is now being banned from subs because the mods are mad he pointed it out.,6706,gje8an,https://imgur.com/a/9xSHamw,518,1589454994.0,,1,2592,2020-05-14 07:16:34
Facts,8678,gkgirt,https://i.redd.it/eph0iczzgwy41.jpg,789,1589602200.0,,1,3119,2020-05-16 00:10:00
"""Epstein's personal photographer found dead, in the woods, after going missing last month. He was rumored to have had a stash of incriminating evidence, photos of Epstein's ""clientele""",6624,g5rs6a,https://archive.vn/g7pw5,443,1587546441.0,,1,2099,2020-04-22 05:07:21
Meanwhile on Airstrip One.....,6755,gk99ji,https://i.redd.it/71yxs8uemxy41.jpg,985,1589578691.0,,1,1947,2020-05-15 17:38:11
The user /u/Dr_Midnight uncovers a massive nationwide astroturfing operation to protest the quarantine,6613,g3xwk0,https://www.reddit.com/r/maryland/comments/g3niq3/i_simply_cannot_believe_that_people_are/fnstpyl,2176,1587283407.0,,1,7021,2020-04-19 04:03:27
Tim Dillion gets it. 👏 👏,6500,ghsaov,https://i.redd.it/rd9dllvt96y41.jpg,574,1589247587.0,,1,4715,2020-05-11 21:39:47
"Epstein didn't kill himself. His bank went active months after his death, and transferred 15 million to a Virgin Island's Bank he owns",6474,gixe2o,https://nymag.com/intelligencer/2020/02/why-did-jeffrey-epsteins-bank-go-active-after-his-death.html,415,1589398895.0,,1,2206,2020-05-13 15:41:35
Daily reminder that Epstein was killed to protect wealthy and high-status pedophiles,6309,gikhwl,https://www.reddit.com/r/conspiracy/comments/gikhwl/daily_reminder_that_epstein_was_killed_to_protect/,433,1589346631.0,"its a fact you know

edit: Epstein wasn't killed, but rescued from jail my mistake",1,2984,2020-05-13 01:10:31
70k Upvotes on a post claiming Trump supporter waves Nazi Flag at Michigan Rally. Man is actually a Bernie Bro at Boise Bernie Fest 2020,6215,g3cnfo,https://i.redd.it/emdyl2vnlgt41.jpg,744,1587193458.0,,1,5875,2020-04-18 03:04:18
Cameras off = masks off,6013,giskag,https://i.redd.it/jdjp6ud2vgy41.jpg,831,1589375799.0,,1,3399,2020-05-13 09:16:39
Let's not forget the US Senators who sold stock before pandemic,5871,gbr74s,https://i.redd.it/zajjf4f658w41.png,363,1588398561.0,,1,3271,2020-05-02 01:49:21
Saw this post on /r/dankmemes earlier today!,5715,g3z8bc,https://i.redd.it/327sai7rhot41.jpg,227,1587288935.0,,1,789,2020-04-19 05:35:35
Have you noticed the difference between Christine Blasey-Ford and Tara Reade and how their cases are being handled?,5709,g9m1xn,https://i.redd.it/y5sdx38cvjv41.jpg,833,1588104707.0,,1,6862,2020-04-28 16:11:47
"""Dear Senator Biden: you are a traitor"" - JFK Jr.",5625,g91w85,https://i.redd.it/x0nv2j7sgdv41.jpg,603,1588027150.0,,1,1673,2020-04-27 18:39:10
"Source Theorists, the governments have already declassified all these texts. It’s out there, it’s everywhere. They still doing it. Including this fairytale novel covid19. It’s for sheeples.",5560,g53a9w,https://i.redd.it/o9d0mr1ny1u41.jpg,1087,1587451991.0,,1,3282,2020-04-21 02:53:11
Elon musk hints that the number of Coronavirus cases could have false reports,5498,g8pc4s,https://i.redd.it/3xrtof0t19v41.png,868,1587973652.0,,1,6146,2020-04-27 03:47:32
We need a Source Theorist to look a source for this.,5485,gg7jow,https://i.redd.it/p1pdzxannnx41.jpg,521,1589022197.0,,1,1698,2020-05-09 07:03:17
Take a break. Walk out and check out the moon. No conspiracy just walk out and enjoy it for what it’s worth,5411,gfk0ct,https://i.redd.it/8r49tmf55gx41.jpg,404,1588931227.0,,1,2603,2020-05-08 05:47:07
"CCP social media ""user""😉",5335,gdr6n8,https://i.redd.it/4nzl8523kvw41.png,414,1588682005.0,,1,2956,2020-05-05 08:33:25
The Out Of The Shadows documentary lifts the mask on how the mainstream media & Hollywood manipulate & control the masses. Our goal is to wake up the general public by shedding light on how we all have been lied to & brainwashed by a hidden enemy with a sinister agenda. Over 7 Million Views Now!!,5247,g2d9de,https://youtu.be/MY8Nfzcn1qQ,798,1587065658.0,,1,5639,2020-04-16 15:34:18
This is a plausible reason.,5164,g4ken6,https://i.redd.it/xydmzbacuvt41.jpg,984,1587377905.0,,1,7130,2020-04-20 06:18:25
"Just in case you still haven't figured it out: Reddit is a bought tool of the Establishment, essentially the digital version of CNN, targeting a younger demographic. The front page isn't decided by your peers. The current play is to convince you that only Trump voters want to protest the lock-down.",4986,g4sisf,https://www.reddit.com/r/conspiracy/comments/g4sisf/just_in_case_you_still_havent_figured_it_out/,1294,1587417133.0,"In case you need proof that this thread is being brigaded, this single sentence (telling you to go back to sleep) is being gang-upvoted by people threatened by this post:

>Not everything is a conspiracy.

No follow up sentence.

No counter-argument.

No proof otherwise.

**Just a single sentence begging you to turn off your brain to conspiracies in a subreddit called r/conspiracy.** 

And it is being mass upvoted!!!

_____

Also, unsurprisingly, the new talking point of the week is to point out that (fake) ""Astroturf"" post botted onto the reddit front page by the propaganda subreddit r/bestof. Now we all know why a 10 year reddit account that had never once posted in this subreddit brought that post to this subreddit to be botted to the top, and why the same brigade made sure this post never left new:

**[\[META\] The supposedly ""massive nationwide astroturfing operation"" post on this subreddit's front page was posted by a 10 year redditor who has never once posted in this subreddit.](https://old.reddit.com/r/conspiracy/comments/g415w5/meta_the_supposedly_massive_nationwide/)**",1,9237,2020-04-20 17:12:13
'Seven'--a forthcoming documentary about the controlled demolition of World Trade Center Building 7 on 9/11 will be a must-watch,4645,g3o6g1,https://www.youtube.com/watch?v=FL9CCZFuDFY,521,1587248151.0,,1,3732,2020-04-18 18:15:51
For anyone out there who is still in blatant denial that there is an agenda behind this “pandemic”.,4631,ghpb1a,https://i.redd.it/2pmpsepvi5y41.jpg,1572,1589238510.0,,1,7855,2020-05-11 19:08:30
"Felix Schroer, cameraman, died of something completely unrelated from corona, yet the media made it into a morbid story saying "" he died after fears he had coronavirus"". His outraged sister has started a petition to hold the media responsible for lying and exploiting people's deaths.",4556,gfvsrh,https://you.38degrees.org.uk/petitions/amend-the-editor-s-code-to-prevent-media-exploitation-of-a-death?bucket&share=ab366b24-c01a-4c05-9533-e97dfa41fbb6&source=facebook-share-email-button&time=1588943248&utm_campaign&utm_source=facebook&fbclid=IwAR158M-TOEGbS_kpeKtvXtl7qSQrx9PpErogCFINH9ui4hQ1RX8XbXKrvAk,357,1588982407.0,,1,1495,2020-05-08 20:00:07
How easily we are programmed to act against common sense.,4538,gb6raw,https://i.redd.it/hsk19cegg1w41.png,815,1588317590.0,,1,6246,2020-05-01 03:19:50
"John Stewart showed clips of Biden being a creep to women and children back when he was VP, why did no one care?",4438,g81ey0,https://twitter.com/realtrevorreese/status/1250975624908472320?s=21,401,1587877784.0,,1,3295,2020-04-26 01:09:44
"The Trump administration paid a bankrupt company with zero employees $55 million for N95 masks, which it's never manufactured",105698,g2izpf,https://www.businessinsider.com/fema-paid-bankrupt-company-no-employees-55-million-n95-masks-2020-4,4794,1587085693.0,,0,32578,2020-04-16 21:08:13
Removed US coronavirus vaccine director files stunning whistleblower complaint claiming warnings were ignored,102053,ge4blp,https://www.independent.co.uk/news/world/americas/us-politics/rick-bright-complaint-read-coronavirus-whistleblower-trump-hydroxychloroquine-a9500586.html,5054,1588735780.0,,0,16854,2020-05-05 23:29:40
Trump suggests injecting disinfectant to treat coronavirus and touts power of sunlight to beat disease,95772,g6wrl2,https://www.independent.co.uk/news/world/americas/us-politics/trump-coronavirus-inject-disinfectant-bleach-treatment-sunlight-a9481291.html,12721,1587710911.0,,0,55119,2020-04-24 02:48:31
The Republicans who were once so pro-life they fought over one woman on life support now want to sacrifice grandma for the economy,83629,g7thtw,https://www.independent.co.uk/voices/terri-schiavo-coronavirus-obama-george-bush-sarah-palin-cares-act-pro-life-trump-a9482671.html,4510,1587850024.0,,0,30403,2020-04-25 17:27:04
Trump walks out of press conference after altercation with female reporters,77828,ghx0k5,https://www.independent.co.uk/news/world/americas/us-politics/trump-press-conference-today-coronavirus-white-house-live-a9509476.html,10043,1589261778.0,,0,49872,2020-05-12 01:36:18
Fact check: McConnell claims Obama didn't leave Trump a pandemic 'game plan.' Obama left a 69-page playbook,74258,giie6o,https://www.cnn.com/2020/05/12/politics/fact-check-mcconnell-obama-trump-game-plan/index.html,3910,1589340372.0,,0,29877,2020-05-12 23:26:12
The pandemic has made this much clear: those running the US have no idea what it costs to live here,73238,ga9jpd,https://www.newstatesman.com/world/north-america/2020/04/pandemic-has-made-much-clear-those-running-us-have-no-idea-what-it-costs,4230,1588196072.0,,0,23745,2020-04-29 17:34:32
"Trump Campaign Secretly Paying $180,000 A Year To His Sons’ Significant Others | Lara Trump and Kimberly Guilfoyle are each receiving $15,000 per month through the campaign manager’s private company, GOP sources said, to dodge FEC rules.",72692,g3c9gi,https://www.huffpost.com/entry/trump-secret-payments-sons-wife-girlfriend_n_5e9a1c46c5b635d25d6c747a,3028,1587192135.0,,0,14457,2020-04-18 02:42:15
Cuomo Reminds McConnell That KY Takes More Money Than NY: ‘Who’s Getting Bailed Out Here?’,72185,g6rex1,https://talkingpointsmemo.com/news/cuomo-reminds-mcconnell-new-york-pays-more-kentucky-state-bailout,4373,1587693436.0,,0,22368,2020-04-23 21:57:16
Trump Livid After California Allows Statewide Mail-In Voting: ‘These Votes Must Not Count’,72173,ggk7vs,https://talkingpointsmemo.com/news/trump-livid-after-california-allows-statewide-mail-in-voting-these-votes-must-not-count,6619,1589076013.0,,0,40413,2020-05-09 22:00:13
'The Public Deserves to Know': Lone Watchdog Demands Federal Reserve Release Names of Corporations Receiving Taxpayer Bailouts,71944,g2dv38,https://www.commondreams.org/news/2020/04/16/public-deserves-know-lone-watchdog-demands-federal-reserve-release-names,2251,1587068421.0,,0,10855,2020-04-16 16:20:21
"'My God,' Says US Senator After William Barr Deploys 'History Is Written by the Winners' Trope | ""The head of the American justice system now saying publicly that there is no good or bad except what the strongest want. The definition of autocracy.""",71487,gfsooe,https://www.commondreams.org/news/2020/05/08/my-god-says-us-senator-after-william-barr-deploys-history-written-winners-trope,4888,1588971272.0,,0,27731,2020-05-08 16:54:32
The sheriff fired her because she’s a lesbian so she ran for his office. She demolished him.,70523,gb0dss,https://www.lgbtqnation.com/2020/04/sheriff-fired-shes-lesbian-ran-office-demolished/,1919,1588297305.0,,0,9092,2020-04-30 21:41:45
"Obama Slams Dropping Of Michael Flynn Case, Calls White House COVID-19 Response 'Absolute Chaotic Disaster'",69402,ggdm2n,https://www.newsweek.com/obama-trump-flynn-biden-1502905,4752,1589051180.0,,0,18217,2020-05-09 15:06:20
Trump’s ‘Liberate Michigan!’ tweets incite insurrection. That’s illegal. | Federal law bans advocating the overthrow of government.,68633,g3eqz4,http://www.washingtonpost.com/outlook/2020/04/17/liberate-michigan-trump-constitution/#click=https://t.co/lVfWquvs3C,7208,1587201206.0,,0,38010,2020-04-18 05:13:26
America doesn’t want another Tea Party - Don’t let Fox News fool you. 81% of Americans do not share the views of anti-quarantine protesters.,67669,g4wzsz,https://www.vox.com/2020/4/20/21225016/protests-stay-at-home-orders-trump-conservative-group-michigan,2904,1587432056.0,,0,26307,2020-04-20 21:20:56
Trump claims the media misrepresented his coronavirus cure comments. Video proves otherwise. The president is now routinely lying about things we saw with our own eyes and that are on tape.,67332,g8iov0,https://www.vox.com/2020/4/26/21237395/trump-birx-coronavirus-disinfectants-light-inside-the-body-spin,4377,1587951783.0,,0,40559,2020-04-26 21:43:03
Trump now claims he spoke 'sarcastically' when repeatedly suggesting people inject disinfectant to cure coronavirus,67112,g7c29n,https://www.independent.co.uk/news/world/americas/us-politics/trump-coronavirus-inject-disinfectant-quote-a9483151.html,6719,1587776493.0,,0,57712,2020-04-24 21:01:33
Twitter names Trump the 'Tide Pods' president after he suggests disinfectant injections,67015,g70sh0,https://www.usatoday.com/story/news/politics/2020/04/23/coronavirus-twitter-reacts-tide-pods-jokes-after-trump-comments/3017279001/,3832,1587726458.0,,0,20360,2020-04-24 07:07:38
Trump Suddenly Loses Interest In Briefings After Disastrous Disinfectant Comments,66006,g8dm2h,https://www.huffpost.com/entry/trump-press-briefings-covid-19-disinfectant-injection_n_5ea4e8b6c5b6805f9ece36a1,4628,1587933357.0,,0,21532,2020-04-26 16:35:57
Mitt Romney sides with Democrats calling for $12 hourly raises for essential workers,65959,gc9fng,https://theweek.com/speedreads/912283/mitt-romney-sides-democrats-calling-12-hourly-raises-essential-workers,3405,1588466256.0,,0,17126,2020-05-02 20:37:36
Vice President Mike Pence tours Mayo Clinic without coronavirus mask even though he was told to wear one,64572,g9sz84,https://www.cnbc.com/2020/04/28/coronavirus-mike-pence-tours-mayo-clinic-without-mask.html,5454,1588128456.0,,0,38910,2020-04-28 22:47:36
Trump Boasts He Likely Saved ‘Billions’ Of Lives In A Nation With 330 Million People,63316,g46xwl,https://www.huffpost.com/entry/trump-saves-billions-us-pop-350-million_n_5e9bd2bec5b6ea335d5cb120,3765,1587328425.0,,0,23131,2020-04-19 16:33:45
"Leaked White House data shows infections spiking more than 1,000% in rural areas that backed Trump | Trump claims cases are falling everywhere. An unreleased task force report shows massive spikes in the heartland",63069,gilmai,https://www.salon.com/2020/05/12/leaked-white-house-data-shows-infections-spiking-more-than-1000-in-rural-areas-that-backed-trump/,3764,1589350185.0,,0,22001,2020-05-13 02:09:45
Sen. Richard Burr steps down as Senate intel chair during coronavirus stock sale probe,59721,gjpawp,https://www.cnbc.com/2020/05/14/sen-richard-burr-steps-down-as-senate-intel-chair-during-coronavirus-stock-sale-probe.html?__source=twitter%7Cmain,1860,1589501389.0,,0,8958,2020-05-14 20:09:49
'I can't imagine why': Trump says he takes no responsibility for people ingesting disinfectant despite telling them to,59595,g9b7l2,https://www.independent.co.uk/news/world/americas/us-politics/donald-trump-coronavirus-ingest-disinfectant-cases-us-white-house-conference-today-a9487106.html,5065,1588056133.0,,0,34695,2020-04-28 02:42:13
Donald Trump is warning “China will own the United States” if Joe Biden is elected president. But Trump himself is tens of millions of dollars in debt to China.,59582,g761fz,https://www.politico.com/news/2020/04/24/trump-biden-china-debt-205475,2744,1587752816.0,,0,27568,2020-04-24 14:26:56
Trump’s Disinfectant Idea Is More Than a Silly Soundbite - it shows he is totally lost in managing the national response.,59460,g788dp,https://www.bloomberg.com/opinion/articles/2020-04-24/donald-trump-s-coronavirus-briefings-don-t-inspire-confidence?srnd=premium&sref=Wa7Llxy6,4302,1587763156.0,,0,34689,2020-04-24 17:19:16
Whitmer says Michigan protests 'depicted some of the worst racism and awful parts of our history',59327,gcrhdy,https://thehill.com/homenews/state-watch/495853-whitmer-says-michigan-protests-depicted-some-of-the-worst-racism-and,4575,1588544849.0,,0,16332,2020-05-03 18:27:29
DeVos sued for seizing student loan borrowers' wages during pandemic,59326,gbjov4,https://www.politico.com/news/2020/05/01/devos-sued-for-seizing-student-loan-borrowers-wages-during-pandemic-228519,2379,1588374101.0,,0,12253,2020-05-01 19:01:41
Senate Intel report confirms Russia aimed to help Trump in 2016,58961,g5gueq,https://www.politico.com/news/2020/04/21/senate-intel-report-confirms-russia-aimed-to-help-trump-in-2016-198171,3060,1587510268.0,,0,18098,2020-04-21 19:04:28
"RBG Immediately Went There, Asked Trump Lawyer How Whitewater and Watergate Were Different from Tax Return Case",58504,giem3i,https://lawandcrime.com/supreme-court/rbg-immediately-went-there-asked-trump-lawyer-how-whitewater-and-watergate-were-different-from-tax-return-case/,3802,1589329863.0,,0,9979,2020-05-12 20:31:03
"Donald Trump's Tab For MAGA Rallies Jumps To $1.8 Million As 14 Cities Say President Hasn't Paid Police Bills, Report Finds",58142,g2omu3,https://www.newsweek.com/donald-trumps-tab-maga-rallies-jumps-18-million-14-cities-say-president-hasnt-paid-police-1498410,2120,1587103021.0,,0,10442,2020-04-17 01:57:01
"Over 70 percent of voters support making 2020 presidential election entirely vote-by-mail, new poll shows",58105,g47a4e,https://www.newsweek.com/over-70-percent-voters-support-making-2020-presidential-election-entirely-vote-mail-new-poll-1498798,2290,1587330014.0,,0,13795,2020-04-19 17:00:14
One of Trump's personal valets has tested positive for coronavirus,57774,gf7yxm,https://amp.cnn.com/cnn/2020/05/07/politics/trump-valet-tests-positive-covid-19/index.html,4243,1588891936.0,,0,9746,2020-05-07 18:52:16
Ruth’s Chris Made $468 Million in Revenue but Gobbled Up $20 Million in Small Business Relief. The steakhouse chain has more than 150 locations and $86 million in cash reserves—and it furloughed workers.,57628,g51hjl,https://www.gq.com/story/ruths-chris-small-business-steakhouse,2971,1587446185.0,,0,22431,2020-04-21 01:16:25
"As Trump Claims US Has Best Covid-19 Testing in the World, Capitol Physician Says He Lacks Capacity to Test All 100 Senators",57608,gbfu4o,https://www.commondreams.org/news/2020/05/01/trump-claims-us-has-best-covid-19-testing-world-capitol-physician-says-he-lacks,1742,1588358577.0,,0,9810,2020-05-01 14:42:57
Fauci's absence from recent coronavirus briefings draws notice,57580,g80qcb,https://www.nbcnews.com/politics/white-house/fauci-s-absence-recent-coronavirus-briefings-draws-notice-n1192421,2197,1587875409.0,,0,7622,2020-04-26 00:30:09
Trump Bragged On Tape Of Being Able To Do Exactly What Biden Is Accused Of,56659,gborlj,https://www.huffpost.com/entry/trump-biden-sexual-assault_n_5eac6410c5b6e5f842972843,7611,1588390576.0,,0,69101,2020-05-01 23:36:16
The coronavirus pandemic has shown that the trickle-down theory of economic growth is a total fabrication,56494,gdbj5o,https://www.businessinsider.com/trickle-down-trumps-economic-policy-failed-for-pandemic-pitchfork-economics-2020-4,2389,1588627412.0,,0,22348,2020-05-04 17:23:32
"“No one” in Puerto Rico has received stimulus checks, says San Juan mayor; The Treasury Department has sent out more than 88 million payments. Not one of them went to Puerto Rico",55918,gavoe8,https://www.salon.com/2020/04/30/no-one-in-puerto-rico-has-received-stimulus-checks-says-san-juan-mayor/,3711,1588282168.0,,0,17367,2020-04-30 17:29:28
Trump Sued for Denying Checks to Americans Married to Immigrants,55896,g7mcm5,https://www.bloomberg.com/news/articles/2020-04-25/trump-sued-for-denying-checks-to-americans-married-to-immigrants,2957,1587812804.0,,0,13973,2020-04-25 07:06:44
"Citing 'Utter Inability to Discharge Duties of His Office,' MoveOn Demands Trump Removal Under 25th Amendment",55758,g7dsv0,https://www.commondreams.org/news/2020/04/24/citing-utter-inability-discharge-duties-his-office-moveon-demands-trump-removal,2111,1587781954.0,,0,10297,2020-04-24 22:32:34
Obama tweets 'vote' after Trump promotes 'Obamagate',55698,gjunih,https://thehill.com/blogs/blog-briefing-room/news/497835-obama-tweets-vote-after-trump-promotes-obamagate,3948,1589517844.0,,0,15131,2020-05-15 00:44:04
"Trump ‘despises’ his own supporters and would be ‘disgusted’ by them, says ex-friend Howard Stern",55560,giwybh,https://www.independent.co.uk/news/world/americas/us-politics/trump-howard-stern-sirius-xm-radio-us-election-a9511436.html,5711,1589396878.0,,0,25321,2020-05-13 15:07:58
