title,score,id,url,comms_num,created,body,classifier,comms_word_count,timestamp
"Trump Says He's Aiming to Shield Corporations From Legal Liability for Workers Who Contract Covid-19 on the Job - ""Businesses are asking for the right to expose their workers to fatal risks with no consequences. It's bad economics and bad policy.""",55105,g5d8dq,https://www.commondreams.org/news/2020/04/21/trump-says-hes-aiming-shield-corporations-legal-liability-workers-who-contract-covid,3737,1587495971.0,,0,31705,2020-04-21 15:06:11
"By dropping Michael Flynn’s case, Barr has stripped centuries of credibility from the department of justice",54751,ghoob6,https://www.independent.co.uk/voices/william-barr-department-justice-michael-flynn-fbi-trump-a9508636.html,3156,1589236480.0,,0,20138,2020-05-11 18:34:40
"One Death Is a Tragedy. 60,000 Deaths Are a Great Success. Most presidents try to console the nation in moments of grief, but Donald Trump is taking a victory lap.",54724,gc506c,https://www.theatlantic.com/ideas/archive/2020/05/trumps-macabre-declarations-victory/611029/,3999,1588448094.0,,0,22678,2020-05-02 15:34:54
"'Unfit, unwell, unacceptable': Anti-Trump Republicans turn president's disastrous disinfectant cure comments into scathing attack ad",54712,g7wnfs,https://www.independent.co.uk/news/world/americas/us-election/trump-coronavirus-disinfectant-republican-attack-ad-covid-19-a9484131.html,3039,1587861899.0,,0,13199,2020-04-25 20:44:59
Trump Says He Won't Approve Covid-19 Package Without Tax Cut That Offers Zero Relief for 30 Million Newly Unemployed,54659,gd92af,https://www.commondreams.org/news/2020/05/04/trump-says-he-wont-approve-covid-19-package-without-tax-cut-offers-zero-relief-30,4507,1588616555.0,,0,21333,2020-05-04 14:22:35
